[
  {
    "id": "clm:identity-name",
    "kind": "fact",
    "subject": "per:duy",
    "statement": "Duy Nguyen is a data scientist and M.S. Data Science candidate based in Seattle, Washington.",
    "short": "Duy Nguyen — Seattle, WA",
    "period": null,
    "status": "verified",
    "tense": "present",
    "confidence": "high",
    "evidenceStrength": "credential",
    "sources": [
      "src:resume-2026-08"
    ],
    "verificationPath": "git show 234cbcd:docs/resume_content.html — contact block, lines 200-206",
    "verifiedOn": "2026-09-02",
    "quote": null,
    "caveats": [],
    "concepts": [
      "cpt:ownership"
    ],
    "skills": [],
    "artifacts": [],
    "derivedFrom": [],
    "surfaces": [
      "page",
      "resume",
      "jsonld",
      "agent"
    ],
    "asserted": true,
    "disputeId": null,
    "lastReviewed": "2026-09-02",
    "reviewEvery": 365,
    "note": null
  },
  {
    "id": "clm:identity-contact",
    "kind": "fact",
    "subject": "per:duy",
    "statement": "Duy can be reached at dnguyen44@seattleu.edu; his profiles are linkedin.com/in/duwe-ng and github.com/dcnguyen060899.",
    "short": "Contact and profiles",
    "period": null,
    "status": "verified",
    "tense": "present",
    "confidence": "high",
    "evidenceStrength": "credential",
    "sources": [
      "src:resume-2026-08",
      "src:portfolio-2026-08"
    ],
    "verificationPath": "git show 234cbcd:docs/resume_content.html — contact block, lines 200-206; the personal gmail address was retired at the owner's instruction, 2026-09-02",
    "verifiedOn": "2026-09-02",
    "quote": null,
    "caveats": [],
    "concepts": [
      "cpt:ownership"
    ],
    "skills": [],
    "artifacts": [
      "art:linkedin",
      "art:github",
      "art:portfolio"
    ],
    "derivedFrom": [],
    "surfaces": [
      "page",
      "resume",
      "jsonld",
      "agent"
    ],
    "asserted": true,
    "disputeId": null,
    "lastReviewed": "2026-09-02",
    "reviewEvery": 365,
    "note": "One email only. The owner asked on 2026-09-02 that the personal gmail address be dropped and dnguyen44@seattleu.edu carry every contact surface — page, resume, JSON-LD and agent."
  },
  {
    "id": "clm:msds-enrolment",
    "kind": "fact",
    "subject": "rol:msds",
    "statement": "Duy is completing an M.S. in Data Science at Seattle University, expected June 2027.",
    "short": "MS Data Science, Seattle U — expected Jun 2027",
    "period": {
      "start": "2025-09",
      "end": "2027-06",
      "precision": "month"
    },
    "status": "verified",
    "tense": "present",
    "confidence": "high",
    "evidenceStrength": "credential",
    "sources": [
      "src:resume-2026-08"
    ],
    "verificationPath": "git show 234cbcd:docs/resume_content.html — Education, lines 224-229",
    "verifiedOn": "2026-09-02",
    "quote": null,
    "caveats": [],
    "concepts": [
      "cpt:statistics",
      "cpt:ml-modeling"
    ],
    "skills": [],
    "artifacts": [],
    "derivedFrom": [],
    "surfaces": [
      "page",
      "resume",
      "jsonld",
      "agent"
    ],
    "asserted": true,
    "disputeId": null,
    "lastReviewed": "2026-09-02",
    "reviewEvery": 365,
    "note": null
  },
  {
    "id": "clm:msds-gpa",
    "kind": "metric",
    "subject": "rol:msds",
    "statement": "Duy holds a 4.0 GPA in the M.S. Data Science programme.",
    "short": "GPA 4.0",
    "value": {
      "display": "4.0",
      "numbers": [
        "4.0"
      ],
      "unit": "GPA",
      "baseline": null,
      "n": null
    },
    "period": null,
    "status": "verified",
    "tense": "present",
    "confidence": "high",
    "evidenceStrength": "credential",
    "sources": [
      "src:resume-2026-08"
    ],
    "verificationPath": "git show 234cbcd:docs/resume_content.html — Education, line 232",
    "verifiedOn": "2026-09-02",
    "quote": "GPA 4.0 — College of Science and Engineering Dean's Graduate Student Honor Roll, Winter 2026",
    "caveats": [],
    "concepts": [
      "cpt:statistics"
    ],
    "skills": [],
    "artifacts": [],
    "derivedFrom": [],
    "surfaces": [
      "page",
      "resume",
      "agent"
    ],
    "asserted": true,
    "disputeId": null,
    "lastReviewed": "2026-09-02",
    "reviewEvery": 180,
    "note": "The ONLY licensed academic-performance figure. '98%+ across all coursework' is retracted (ret:gpa-98-percent) and every individual term GPA is retracted as a class (ret:term-gpa-range). Per Addendum B R-8 this belongs in the education credentials block, NOT in the hero: the loudest numbers on the page are research results."
  },
  {
    "id": "clm:msds-honor-roll",
    "kind": "fact",
    "subject": "rol:msds",
    "statement": "Duy was named to the Seattle University College of Science and Engineering Dean's Graduate Student Honor Roll for Winter 2026.",
    "short": "Dean's Honor Roll, Winter 2026",
    "period": {
      "start": "2026-01",
      "end": "2026-03",
      "precision": "quarter"
    },
    "status": "verified",
    "tense": "past",
    "confidence": "high",
    "evidenceStrength": "credential",
    "sources": [
      "src:resume-2026-08"
    ],
    "verificationPath": "git show 234cbcd:docs/resume_content.html — Education, line 232",
    "verifiedOn": "2026-09-02",
    "quote": null,
    "caveats": [],
    "concepts": [
      "cpt:statistics"
    ],
    "skills": [],
    "artifacts": [],
    "derivedFrom": [],
    "surfaces": [
      "page",
      "resume",
      "agent"
    ],
    "asserted": true,
    "disputeId": null,
    "lastReviewed": "2026-09-02",
    "reviewEvery": 365,
    "note": null
  },
  {
    "id": "clm:msds-structure",
    "kind": "metric",
    "subject": "rol:msds",
    "statement": "The Seattle University M.S. Data Science is 45 credits — 36 required and 9 elective — across roughly six quarters, ending in a two-quarter capstone run with industry partners.",
    "short": "45 credits: 36 required + 9 elective",
    "value": {
      "display": "45 credits (36 required + 9 elective)",
      "numbers": [
        "45",
        "36",
        "9"
      ],
      "unit": "credits",
      "baseline": null,
      "n": null
    },
    "period": null,
    "status": "verified",
    "tense": "present",
    "confidence": "high",
    "evidenceStrength": "credential",
    "sources": [
      "src:su-catalog"
    ],
    "verificationPath": "https://catalog.seattleu.edu/ — 2026-2027 Graduate Catalog, M.S. Data Science",
    "verifiedOn": "2026-09-02",
    "quote": null,
    "caveats": [],
    "concepts": [
      "cpt:statistics",
      "cpt:ml-modeling"
    ],
    "skills": [],
    "artifacts": [
      "art:su-catalog-msds"
    ],
    "derivedFrom": [],
    "surfaces": [
      "page",
      "resume",
      "agent"
    ],
    "asserted": true,
    "disputeId": null,
    "lastReviewed": "2026-09-02",
    "reviewEvery": 365,
    "note": "A claim about the PROGRAMME, not about what Duy has completed."
  },
  {
    "id": "clm:msds-capstone",
    "kind": "fact",
    "subject": "rol:msds",
    "statement": "The programme ends in a two-quarter capstone, DATA 5901 and DATA 5902, run with industry partners.",
    "short": "Two-quarter industry capstone",
    "period": null,
    "status": "verified",
    "tense": "present",
    "confidence": "high",
    "evidenceStrength": "coursework",
    "sources": [
      "src:su-catalog"
    ],
    "verificationPath": "https://catalog.seattleu.edu/ — MSDS required course list",
    "verifiedOn": "2026-09-02",
    "quote": null,
    "caveats": [],
    "concepts": [
      "cpt:stakeholder",
      "cpt:ownership"
    ],
    "skills": [],
    "artifacts": [
      "art:su-catalog-msds"
    ],
    "derivedFrom": [],
    "surfaces": [
      "page",
      "agent"
    ],
    "asserted": true,
    "disputeId": null,
    "lastReviewed": "2026-09-02",
    "reviewEvery": 365,
    "note": null
  },
  {
    "id": "clm:msds-stats-sequence",
    "kind": "fact",
    "subject": "rol:msds",
    "statement": "Duy's required coursework includes DATA 5300 Applied Statistical Inference and Experimental Design, DATA 5111 Probability for Data Science, and the two-course Statistical Machine Learning sequence, DATA 5321 and DATA 5322.",
    "short": "Inference, experimental design, statistical ML I and II",
    "period": null,
    "status": "verified",
    "tense": "present",
    "confidence": "high",
    "evidenceStrength": "coursework",
    "sources": [
      "src:su-catalog"
    ],
    "verificationPath": "https://catalog.seattleu.edu/ — MSDS required course list",
    "verifiedOn": "2026-09-02",
    "quote": null,
    "caveats": [],
    "concepts": [
      "cpt:statistics",
      "cpt:experimental-design",
      "cpt:ml-modeling"
    ],
    "skills": [],
    "artifacts": [
      "art:su-catalog-msds"
    ],
    "derivedFrom": [],
    "surfaces": [
      "page",
      "agent"
    ],
    "asserted": true,
    "disputeId": null,
    "lastReviewed": "2026-09-02",
    "reviewEvery": 365,
    "note": "DATA 5321 is the course Duy took with Dr. Yang, which is where the research relationship started — see clm:yang-origin-course."
  },
  {
    "id": "clm:msds-data-management",
    "kind": "fact",
    "subject": "rol:msds",
    "statement": "Duy's required coursework includes CPSC 5071 Data Management for Data Science and CPSC 5070 Programming for Data Science.",
    "short": "Data management and programming coursework",
    "period": null,
    "status": "verified",
    "tense": "present",
    "confidence": "high",
    "evidenceStrength": "coursework",
    "sources": [
      "src:su-catalog"
    ],
    "verificationPath": "https://catalog.seattleu.edu/ — MSDS required course list",
    "verifiedOn": "2026-09-02",
    "quote": null,
    "caveats": [],
    "concepts": [
      "cpt:sql",
      "cpt:schema-design",
      "cpt:python"
    ],
    "skills": [],
    "artifacts": [
      "art:su-catalog-msds"
    ],
    "derivedFrom": [],
    "surfaces": [
      "agent"
    ],
    "asserted": true,